{
  "$schema": "https://json-schema.org/draft/2020-12/schema",
  "$id": "res://data/contracts/skill_nodes.schema.json",
  "title": "技能节点共享合同元规范",
  "type": "object",
  "required": ["contract_version", "runtime_rules", "nodes", "labels", "help", "ui_presentation"],
  "additionalProperties": false,
  "properties": {
    "contract_version": {"type": "integer", "minimum": 1},
    "runtime_rules": {
      "type": "object", "required": ["targeting", "movement", "normalization", "validation", "validation_codes"], "additionalProperties": false,
      "properties": {
        "targeting": {"type":"object","required":["root_fields","selection","area","affects"],"additionalProperties":false,"properties":{"root_fields":{"$ref":"#/$defs/stringArray"},"selection":{"$ref":"#/$defs/selectionRules"},"area":{"$ref":"#/$defs/areaRules"},"affects":{"$ref":"#/$defs/affectsRules"}}},
        "movement": {"type":"object","required":["modes","selection_defining","effect_followup","allowed_atomic_combinations","targets","defaults","required_fields","valid_fields","derived_rules"],"additionalProperties":false,"properties":{"modes":{"$ref":"#/$defs/stringArray"},"selection_defining":{"$ref":"#/$defs/stringArray"},"effect_followup":{"$ref":"#/$defs/stringArray"},"allowed_atomic_combinations":{"type":"array","items":{"$ref":"#/$defs/stringArray"}},"targets":{"$ref":"#/$defs/stringArray"},"defaults":{"type":"object","required":["targets"],"additionalProperties":false,"properties":{"targets":{"type":"string"}}},"required_fields":{"type":"object","additionalProperties":{"$ref":"#/$defs/stringArray"}},"valid_fields":{"type":"object","additionalProperties":{"$ref":"#/$defs/stringArray"}},"derived_rules":{"type":"object","additionalProperties":{"$ref":"#/$defs/derivedRule"}}}},
        "normalization": {"type":"object","required":["targeting_order","selection_order","area_order","affects_order","movement_order","omit_explicit_defaults","omit_empty_containers"],"additionalProperties":false,"properties":{"targeting_order":{"$ref":"#/$defs/stringArray"},"selection_order":{"$ref":"#/$defs/stringArray"},"area_order":{"$ref":"#/$defs/stringArray"},"affects_order":{"$ref":"#/$defs/stringArray"},"movement_order":{"$ref":"#/$defs/stringArray"},"omit_explicit_defaults":{"type":"boolean"},"omit_empty_containers":{"type":"boolean"}}},
        "validation": {"$ref":"#/$defs/validationRules"},
        "validation_codes": {"$ref":"#/$defs/stringArray"}
      }
    },
    "nodes": {"type":"object","minProperties":1,"additionalProperties":{"$ref":"#/$defs/node"}},
    "labels": {"$ref":"#/$defs/metadata"},
    "help": {"$ref":"#/$defs/metadata"},
    "ui_presentation": {"type":"object","required":["section_order","advanced_fields","readonly_derived","block_when_contract_unavailable"],"additionalProperties":false,"properties":{"section_order":{"$ref":"#/$defs/stringArray"},"advanced_fields":{"$ref":"#/$defs/stringArray"},"readonly_derived":{"$ref":"#/$defs/stringArray"},"block_when_contract_unavailable":{"const":true}}}
  },
  "$defs": {
    "stringArray": {"type":"array","items":{"type":"string","minLength":1},"uniqueItems":true},
    "selectionRules": {"type":"object","required":["discriminator","types","patterns","visibility","occupancy","relations","entity_types","directions","defaults","fields_by_type","consumer_by_type","required_by_type","non_empty_array_fields"],"additionalProperties":false,"properties":{"discriminator":{"const":"type"},"types":{"$ref":"#/$defs/stringArray"},"patterns":{"$ref":"#/$defs/stringArray"},"visibility":{"$ref":"#/$defs/stringArray"},"occupancy":{"$ref":"#/$defs/stringArray"},"relations":{"$ref":"#/$defs/stringArray"},"entity_types":{"$ref":"#/$defs/stringArray"},"directions":{"$ref":"#/$defs/stringArray"},"defaults":{"type":"object","additionalProperties":false,"properties":{"pattern":{},"visibility":{},"min_targets":{},"max_targets":{},"directions":{}}},"fields_by_type":{"type":"object","additionalProperties":{"$ref":"#/$defs/stringArray"}},"consumer_by_type":{"type":"object","required":["self","entity","entity_result","cell","direction"],"additionalProperties":false,"properties":{"self":{"enum":["cells","entities","direction","none"]},"entity":{"enum":["cells","entities","direction","none"]},"entity_result":{"enum":["cells","entities","direction","none"]},"cell":{"enum":["cells","entities","direction","none"]},"direction":{"enum":["cells","entities","direction","none"]}}},"required_by_type":{"type":"object","additionalProperties":{"$ref":"#/$defs/stringArray"}},"non_empty_array_fields":{"$ref":"#/$defs/stringArray"}}},
    "areaRules": {"type":"object","required":["anchors","shapes","defaults","size_shapes","include_anchor_shapes","params_by_shape","required_fields_by_shape","forbidden_fields_by_shape","param_constraints","allowed_selection_types_by_shape","anchor_derivation"],"additionalProperties":false,"properties":{"anchors":{"$ref":"#/$defs/stringArray"},"shapes":{"$ref":"#/$defs/stringArray"},"defaults":{"type":"object","required":["include_anchor"],"additionalProperties":false,"properties":{"include_anchor":{"type":"boolean"}}},"size_shapes":{"$ref":"#/$defs/stringArray"},"include_anchor_shapes":{"$ref":"#/$defs/stringArray"},"params_by_shape":{"type":"object","additionalProperties":{"$ref":"#/$defs/stringArray"}},"required_fields_by_shape":{"type":"object","additionalProperties":{"$ref":"#/$defs/stringArray"}},"forbidden_fields_by_shape":{"type":"object","additionalProperties":{"$ref":"#/$defs/stringArray"}},"param_constraints":{"type":"object","additionalProperties":{"$ref":"#/$defs/paramConstraint"}},"allowed_selection_types_by_shape":{"type":"object","additionalProperties":{"$ref":"#/$defs/stringArray"}},"anchor_derivation":{"$ref":"#/$defs/stringArray"}}},
    "affectsRules": {"type":"object","required":["fields","required","non_empty_array_fields","entity_selection_default","constraints"],"additionalProperties":false,"properties":{"fields":{"$ref":"#/$defs/stringArray"},"required":{"$ref":"#/$defs/stringArray"},"non_empty_array_fields":{"$ref":"#/$defs/stringArray"},"entity_selection_default":{"type":"string"},"constraints":{"type":"array","items":{"$ref":"#/$defs/affectsConstraint"}}}},
    "affectsConstraint": {"type":"object","required":["operator","code_key"],"additionalProperties":false,"properties":{"operator":{"enum":["affects_required_for_entity_consumer","affects_forbidden_for_cells_only_consumer","direction_affects_requires_area"]},"code_key":{"type":"string","minLength":1}}},
    "paramConstraint": {"type":"object","additionalProperties":false,"properties":{"required":{"$ref":"#/$defs/stringArray"},"integer_min":{"type":"object","additionalProperties":{"type":"integer","minimum":0}},"odd":{"$ref":"#/$defs/stringArray"},"non_empty_arrays":{"$ref":"#/$defs/stringArray"},"offset_pair_integers":{"type":"boolean"}}},
    "derivedRule": {"type":"object","additionalProperties":false,"properties":{"selection_type":{"type":"string"},"distance_source":{"type":"string"},"path":{"type":"string"},"occupancy":{"type":"string"},"pattern":{"type":"string"},"directions":{"$ref":"#/$defs/stringArray"},"target":{"type":"string"},"requires_active_movement":{"type":"boolean"},"min_targets":{"type":"integer","minimum":1},"max_targets":{"type":"integer","minimum":1},"min_distance":{"type":"integer","minimum":0},"forbidden_relations":{"$ref":"#/$defs/stringArray"},"forbid":{"$ref":"#/$defs/stringArray"}}},
    "validationRules": {"type":"object","required":["field_constraints","blocking_codes"],"additionalProperties":false,"properties":{"field_constraints":{"type":"object","additionalProperties":{"$ref":"#/$defs/fieldConstraint"}},"blocking_codes":{"type":"object","additionalProperties":{"type":"string","minLength":1}}}},
    "fieldConstraint": {"type":"object","required":["type","code"],"additionalProperties":false,"properties":{"type":{"enum":["integer","number"]},"min":{"type":"number"},"max":{"type":"number"},"code":{"type":"string","minLength":1}}},
    "metadata": {"type":"object","required":["nodes","fields"],"additionalProperties":false,"properties":{"nodes":{"type":"object","additionalProperties":{"type":"string","minLength":1}},"fields":{"type":"object","additionalProperties":{"type":"string","minLength":1}}}},
    "arrayItem": {"type":"object","required":["type"],"additionalProperties":false,"properties":{"type":{"enum":["int","float","string","bool","array","dict","node"]},"min":{"type":"number"},"max":{"type":"number"},"options":{"type":"array","items":{"type":"string"},"uniqueItems":true},"allowed_node_types":{"$ref":"#/$defs/stringArray"},"fields":{"type":"array","items":{"$ref":"#/$defs/field"}},"items":{"$ref":"#/$defs/arrayItem"}},"allOf":[{"if":{"properties":{"type":{"const":"array"}},"required":["type"]},"then":{"properties":{"items":{"$ref":"#/$defs/arrayItem"}},"required":["items"]}},{"if":{"properties":{"type":{"const":"dict"}},"required":["type"]},"then":{"properties":{"fields":{"type":"array","items":{"$ref":"#/$defs/field"}}},"required":["fields"]}}]},
    "field": {"type":"object","required":["name","type"],"additionalProperties":false,"properties":{"name":{"type":"string","minLength":1},"type":{"enum":["int","float","string","bool","array","dict"]},"required":{"type":"boolean"},"default":{},"min":{"type":"number"},"max":{"type":"number"},"options":{"type":"array","items":{"type":"string"},"uniqueItems":true},"fields":{"type":"array","items":{"$ref":"#/$defs/field"}},"items":{"$ref":"#/$defs/arrayItem"},"visible_when":{"type":"object"},"targeting_scope":{"enum":["cast","deferred"]}},"allOf":[{"if":{"properties":{"type":{"const":"array"}},"required":["type"]},"then":{"properties":{"items":{"$ref":"#/$defs/arrayItem"}},"required":["items"]}},{"if":{"properties":{"type":{"const":"dict"}},"required":["type"]},"then":{"properties":{"fields":{"type":"array","items":{"$ref":"#/$defs/field"}}},"required":["fields"]}}]},
    "node": {"type":"object","required":["fields","consumes","accepted_capabilities","candidate_gate"],"additionalProperties":false,"properties":{"fields":{"type":"array","items":{"$ref":"#/$defs/field"}},"consumes":{"type":"array","items":{"enum":["cells","entities","direction","none"]},"uniqueItems":true},"accepted_capabilities":{"$ref":"#/$defs/stringArray"},"candidate_gate":{"oneOf":[{"type":"boolean"},{"type":"object"}]},"roles":{"type":"array","items":{"enum":["deploy"]},"uniqueItems":true}}}
  }
}
