{
  "contract_version": 1,
  "help": {
    "nodes": {
      "ap_cost": "定义技能行动点消耗。",
      "cooldown": "定义技能使用后的冷却。",
      "mana_cost": "定义技能法力消耗。",
      "targeting": "定义选取、覆盖格和影响实体。",
      "damage": "对兼容实体造成伤害。",
      "heal": "对兼容实体恢复生命。",
      "status_effect": "向兼容实体施加状态。",
      "movement": "按模式执行主动或强制位移。",
      "summon": "在目标格创建召唤物。",
      "trap": "在目标格放置陷阱。",
      "dispel": "移除目标实体状态。",
      "condition": "按条件选择子节点分支。",
      "sequence": "按顺序执行子节点。",
      "delayed_cast": "在指定时机重放子效果。",
      "charge": "定义蓄力施放规则。",
      "avatar_transform": "临时切换角色形态。",
      "terrain_creation": "在目标格创建地形。",
      "stat_modifier": "以正式 StatDefinition 的数值结构和 ADD 规则修改目标属性。",
      "armor_gain": "向目标的护甲资源层加入临时护甲；它不是 Stat Modifier。"
    },
    "fields": {
      "ap_cost.cost": "技能消耗的行动点。",
      "cooldown.turns": "使用后等待的回合数。",
      "mana_cost.cost": "技能消耗的法力值。",
      "targeting.selection": "玩家或AI必须提供的选择输入。",
      "targeting.area": "从锚点展开的覆盖格规则。",
      "targeting.affects": "覆盖格中的实体过滤规则。",
      "damage.base_damage": "不含倍率的基础伤害。",
      "damage.damage_type": "决定伤害结算类型。",
      "damage.element": "决定元素关联。",
      "damage.ad_ratio": "攻击力缩放比例。",
      "damage.sp_ratio": "法术强度缩放比例。",
      "damage.scaling_type": "编辑器展示的缩放家族。",
      "damage.multi_hit_count": "每个目标的命中次数。",
      "damage.multi_hit_decay": "额外命中的递减比例。",
      "damage.target_relations": "只影响技能级关系集合中的指定关系。",
      "heal.base_heal": "不含修正的基础治疗量。",
      "heal.target": "治疗目标语义。",
      "heal.target_relations": "只影响技能级关系集合中的指定关系。",
      "status_effect.status": "要施加的状态标识。",
      "status_effect.duration": "状态持续回合。",
      "status_effect.chance": "状态成功概率。",
      "status_effect.stacks": "初次施加层数。",
      "status_effect.target_relations": "只影响技能级关系集合中的指定关系。",
      "movement.mode": "决定选择消费和路径规则。",
      "movement.targets": "推拉使用直接或范围影响目标。",
      "movement.distance": "方向冲刺或强制位移距离。",
      "movement.target_relations": "只移动技能级关系集合中的指定关系。",
      "summon.summon_id": "对应召唤物定义ID。",
      "summon.summon_count": "本次创建数量。",
      "summon.summon_range": "召唤位置范围。",
      "summon.max_count": "同时存在数量上限。",
      "summon.agent_type": "运行时代理类型。",
      "summon.agent_rank": "代理治理等级。",
      "summon.persistence_mode": "设计层存续模式。",
      "summon.persistence": "运行时存续枚举。",
      "summon.duration": "临时召唤持续时间。",
      "summon.display_name": "召唤物显示名。",
      "summon.source_skill_id": "记录来源技能。",
      "summon.damage_element": "召唤物伤害元素。",
      "summon.inheritance_profile": "属性继承方案。",
      "summon.base_stats": "召唤物基础属性。",
      "summon.behaviors": "召唤物行为配置。",
      "summon.damage_modifier": "伤害倍率修正。",
      "summon.death_penalty": "死亡后的惩罚规则。",
      "summon.respawn_cooldown": "重生等待回合。",
      "summon.source_tag": "来源分类标签。",
      "summon.tags": "召唤物标签集合。",
      "trap.trap_damage": "触发时基础伤害。",
      "trap.trigger_effects": "陷阱实际触发后对触发目标执行的嵌套效果。",
      "trap.trap_trigger": "决定单位踩中时触发，或在回合开始检查区域。",
      "trap.trap_trigger_range": "区域检查触发方式使用的格子半径。",
      "trap.trap_duration": "陷阱保留在战场上的回合数。",
      "dispel.dispel_type": "决定移除增益或减益。",
      "dispel.target_relations": "只影响技能级关系集合中的指定关系。",
      "condition.condition_type": "决定条件判断方式。",
      "condition.threshold": "条件比较阈值。",
      "condition.status_check": "需要检查的状态ID。",
      "condition.then_nodes": "条件成立时执行。",
      "condition.else_nodes": "条件不成立时执行。",
      "sequence.children": "依次执行的子节点。",
      "delayed_cast.timing": "延后效果触发时机。",
      "delayed_cast.anchor_source": "延后效果定位来源。",
      "delayed_cast.trigger_once": "是否仅触发一次。",
      "delayed_cast.inherit_snapshot": "是否继承首段数值快照。",
      "delayed_cast.allow_empty_fire": "锚点无目标时是否执行。",
      "delayed_cast.children": "延后执行的效果节点。",
      "charge.charge_turns": "完成蓄力所需回合。",
      "charge.charge_ap_per_turn": "每回合蓄力消耗。",
      "charge.interruptible": "蓄力是否可被打断。",
      "charge.interrupt_preserve": "打断后保留进度比例。",
      "avatar_transform.form_duration": "形态维持回合。",
      "avatar_transform.replaced_skills": "形态期间替换的技能。",
      "avatar_transform.stat_bonuses": "形态提供的属性修正。",
      "avatar_transform.on_expire_effect": "形态结束时执行的效果。",
      "avatar_transform.target_relations": "只影响技能级关系集合中的指定关系。",
      "terrain_creation.field_spec_id": "对应正式 FieldSpec；地形与区域必须由同一创建请求绑定。",
      "terrain_creation.terrain_type": "要创建的地形ID。",
      "terrain_creation.duration": "地形持续回合。",
      "terrain_creation.position": "使用命中格或自身格。",
      "stat_modifier.stat_id": "必须是已注册的 canonical Stat ID。",
      "stat_modifier.operation": "当前只允许 ADD。",
      "stat_modifier.typed_value": "按 value_schema_ref 表示的实际数值；百分比使用 percentage points。",
      "stat_modifier.value_schema_ref": "必须等于目标 StatDefinition 的 value_schema_ref。",
      "stat_modifier.duration": "-1 表示该来源未设到期；正数按回合到期撤销。",
      "stat_modifier.target_relations": "只影响技能级关系集合中的指定关系。",
      "armor_gain.amount": "加入护甲资源层的点数。",
      "armor_gain.target_relations": "只影响技能级关系集合中的指定关系。"
    }
  },
  "labels": {
    "nodes": {
      "ap_cost": "AP消耗",
      "cooldown": "冷却回合",
      "mana_cost": "法力消耗",
      "targeting": "目标选择",
      "damage": "造成伤害",
      "movement": "位移效果",
      "terrain_creation": "创造地形",
      "condition": "条件分支",
      "sequence": "顺序执行",
      "delayed_cast": "延后施放",
      "summon": "召唤物"
    },
    "fields": {}
  },
  "ui_presentation": {
    "section_order": [
      "selection",
      "area",
      "affects",
      "movement"
    ],
    "advanced_fields": [],
    "readonly_derived": [
      "area.anchor"
    ],
    "block_when_contract_unavailable": true
  },
  "runtime_rules": {
    "targeting": {
      "root_fields": [
        "selection",
        "area",
        "affects"
      ],
      "selection": {
        "discriminator": "type",
        "types": [
          "self",
          "entity",
          "cell",
          "direction"
        ],
        "patterns": [
          "diamond",
          "cardinal"
        ],
        "visibility": [
          "ignore",
          "line_of_sight"
        ],
        "occupancy": [
          "empty",
          "occupied",
          "any"
        ],
        "relations": [
          "self",
          "ally",
          "enemy",
          "neutral"
        ],
        "entity_types": [
          "character",
          "minion",
          "deployable",
          "implement",
          "destructible"
        ],
        "directions": [
          "up",
          "right",
          "down",
          "left"
        ],
        "defaults": {
          "pattern": "diamond",
          "visibility": "ignore",
          "min_targets": 1,
          "max_targets": 1,
          "directions": [
            "up",
            "right",
            "down",
            "left"
          ]
        },
        "fields_by_type": {
          "self": [
            "type"
          ],
          "entity": [
            "type",
            "distance",
            "pattern",
            "visibility",
            "relations",
            "entity_types",
            "min_targets",
            "max_targets",
            "directions"
          ],
          "cell": [
            "type",
            "distance",
            "pattern",
            "visibility",
            "occupancy",
            "directions"
          ],
          "direction": [
            "type",
            "directions"
          ]
        },
        "consumer_by_type": {
          "self": "entities",
          "entity": "entities",
          "entity_result": "entities",
          "cell": "cells",
          "direction": "direction"
        },
        "required_by_type": {
          "self": [
            "type"
          ],
          "entity": [
            "type",
            "distance",
            "relations"
          ],
          "cell": [
            "type",
            "distance",
            "occupancy"
          ],
          "direction": [
            "type",
            "directions"
          ]
        },
        "non_empty_array_fields": [
          "relations",
          "entity_types",
          "directions"
        ]
      },
      "area": {
        "anchors": [
          "self",
          "selected",
          "each_selected"
        ],
        "shapes": [
          "circle",
          "diamond",
          "cross",
          "x_shape",
          "star",
          "square",
          "ring",
          "line",
          "cone",
          "arc",
          "rectangle",
          "path",
          "global",
          "custom"
        ],
        "defaults": {
          "include_anchor": true
        },
        "size_shapes": [
          "circle",
          "diamond",
          "cross",
          "x_shape",
          "star",
          "square",
          "ring",
          "line",
          "cone",
          "arc"
        ],
        "include_anchor_shapes": [
          "circle",
          "diamond",
          "cross",
          "x_shape",
          "star",
          "square",
          "arc",
          "rectangle",
          "custom"
        ],
        "params_by_shape": {
          "rectangle": [
            "width",
            "height"
          ],
          "path": [
            "width"
          ],
          "custom": [
            "offsets"
          ]
        },
        "required_fields_by_shape": {
          "circle": [
            "size"
          ],
          "diamond": [
            "size"
          ],
          "cross": [
            "size"
          ],
          "x_shape": [
            "size"
          ],
          "star": [
            "size"
          ],
          "square": [
            "size"
          ],
          "ring": [
            "size"
          ],
          "line": [
            "size"
          ],
          "cone": [
            "size"
          ],
          "arc": [
            "size"
          ],
          "rectangle": [
            "params"
          ],
          "path": [
            "params"
          ],
          "global": [],
          "custom": [
            "params"
          ]
        },
        "forbidden_fields_by_shape": {
          "rectangle": [
            "size"
          ],
          "path": [
            "size",
            "include_anchor"